{
  "assessment_digest": "sha256:cd9dad54fae3849538859784b8167bb49df9a9a2c71660fe79890e756701c313",
  "canonicality": "INTERNAL_WORLD_CALIBRATION_NOT_EMPIRICAL_FACT",
  "final_iteration_id": "calibration-iteration://cal0/i4/reference-successor@1",
  "final_overrides": {
    "parameter://cal0/adaptation/gain-scale@1": "0.036",
    "parameter://cal0/xp/class-exponent@1": "1.90",
    "parameter://cal0/xp/class-total-scale@1": "205",
    "parameter://cal0/xp/skill-total-scale@1": "106"
  },
  "parameter_set_id": "parameter-set://cal0/i4-reference@1",
  "parent_parameter_set_id": "parameter-set://cal0/i3-reference@1",
  "provenance": [
    "litrpg-system-specification.md#VAL1.0",
    "litrpg-system-calibration-annex.md#CAL0-I4",
    "cohort-plan://cal0/i4-human-reference@1"
  ],
  "provisional_parameter_assessments": [
    {
      "classification": "NOT_IDENTIFIABLE_FROM_I4_COHORT_OBSERVABLES",
      "confounding_family": null,
      "high_shifts": {
        "adult_capacity_p50": "0",
        "class_form_completion_rate": "0",
        "independent_mage_rate": "0",
        "injury_rate": "0",
        "skill_form_completion_rate": "0",
        "training_contribution_p50": "0"
      },
      "low_shifts": {
        "adult_capacity_p50": "0",
        "class_form_completion_rate": "0",
        "independent_mage_rate": "0",
        "injury_rate": "0",
        "skill_form_completion_rate": "0",
        "training_contribution_p50": "0"
      },
      "maximum_relative_effect": "0",
      "parameter_id": "parameter://cal0/adaptation/beta-concentration@1",
      "reason": "The active I4 life-course observables do not contain this parameter's mechanism; zero numerical sensitivity is not evidence that the parameter is causally irrelevant."
    },
    {
      "classification": "NOT_IDENTIFIABLE_FROM_I4_COHORT_OBSERVABLES",
      "confounding_family": null,
      "high_shifts": {
        "adult_capacity_p50": "0",
        "class_form_completion_rate": "0",
        "independent_mage_rate": "0",
        "injury_rate": "0",
        "skill_form_completion_rate": "0",
        "training_contribution_p50": "0"
      },
      "low_shifts": {
        "adult_capacity_p50": "0",
        "class_form_completion_rate": "0",
        "independent_mage_rate": "0",
        "injury_rate": "0",
        "skill_form_completion_rate": "0",
        "training_contribution_p50": "0"
      },
      "maximum_relative_effect": "0",
      "parameter_id": "parameter://cal0/adaptation/beta-mode@1",
      "reason": "The active I4 life-course observables do not contain this parameter's mechanism; zero numerical sensitivity is not evidence that the parameter is causally irrelevant."
    },
    {
      "classification": "WEAKLY_IDENTIFIED",
      "confounding_family": null,
      "high_shifts": {
        "adult_capacity_p50": "0.00034628",
        "class_form_completion_rate": "0",
        "independent_mage_rate": "0",
        "injury_rate": "0",
        "skill_form_completion_rate": "0",
        "training_contribution_p50": "0.0035391"
      },
      "low_shifts": {
        "adult_capacity_p50": "0.00019214",
        "class_form_completion_rate": "0",
        "independent_mage_rate": "0",
        "injury_rate": "0",
        "skill_form_completion_rate": "0",
        "training_contribution_p50": "0.00483366"
      },
      "maximum_relative_effect": "0.00483366",
      "parameter_id": "parameter://cal0/adaptation/detraining-weekly@1",
      "reason": "One-at-a-time perturbation changes at least one protected I4 output."
    },
    {
      "classification": "WEAKLY_IDENTIFIED",
      "confounding_family": null,
      "high_shifts": {
        "adult_capacity_p50": "0",
        "class_form_completion_rate": "0",
        "independent_mage_rate": "0",
        "injury_rate": "0",
        "skill_form_completion_rate": "0",
        "training_contribution_p50": "0"
      },
      "low_shifts": {
        "adult_capacity_p50": "0",
        "class_form_completion_rate": "0",
        "independent_mage_rate": "0",
        "injury_rate": "0.00230947",
        "skill_form_completion_rate": "0",
        "training_contribution_p50": "0"
      },
      "maximum_relative_effect": "0.00230947",
      "parameter_id": "parameter://cal0/adaptation/excessive@1",
      "reason": "One-at-a-time perturbation changes at least one protected I4 output."
    },
    {
      "classification": "INFLUENTIAL_CONFOUNDED",
      "confounding_family": "adaptation_gain_x_trainability_x_access",
      "high_shifts": {
        "adult_capacity_p50": "0.00342808",
        "class_form_completion_rate": "0",
        "independent_mage_rate": "0",
        "injury_rate": "0",
        "skill_form_completion_rate": "0",
        "training_contribution_p50": "0.05196427"
      },
      "low_shifts": {
        "adult_capacity_p50": "0.00646241",
        "class_form_completion_rate": "0",
        "independent_mage_rate": "0",
        "injury_rate": "0",
        "skill_form_completion_rate": "0",
        "training_contribution_p50": "0.07741586"
      },
      "maximum_relative_effect": "0.07741586",
      "parameter_id": "parameter://cal0/adaptation/functional-envelope-scale@1",
      "reason": "One-at-a-time perturbation changes at least one protected I4 output."
    },
    {
      "classification": "INFLUENTIAL_CONFOUNDED",
      "confounding_family": "adaptation_gain_x_trainability_x_access",
      "high_shifts": {
        "adult_capacity_p50": "0.01033068",
        "class_form_completion_rate": "0",
        "independent_mage_rate": "0",
        "injury_rate": "0",
        "skill_form_completion_rate": "0",
        "training_contribution_p50": "0.19374662"
      },
      "low_shifts": {
        "adult_capacity_p50": "0.0039056",
        "class_form_completion_rate": "0",
        "independent_mage_rate": "0",
        "injury_rate": "0",
        "skill_form_completion_rate": "0",
        "training_contribution_p50": "0.08081692"
      },
      "maximum_relative_effect": "0.19374662",
      "parameter_id": "parameter://cal0/adaptation/gain-scale@1",
      "reason": "One-at-a-time perturbation changes at least one protected I4 output."
    },
    {
      "classification": "PRACTICALLY_NON_IDENTIFIABLE",
      "confounding_family": null,
      "high_shifts": {
        "adult_capacity_p50": "0",
        "class_form_completion_rate": "0",
        "independent_mage_rate": "0",
        "injury_rate": "0",
        "skill_form_completion_rate": "0",
        "training_contribution_p50": "0"
      },
      "low_shifts": {
        "adult_capacity_p50": "0",
        "class_form_completion_rate": "0",
        "independent_mage_rate": "0",
        "injury_rate": "0",
        "skill_form_completion_rate": "0",
        "training_contribution_p50": "0"
      },
      "maximum_relative_effect": "0",
      "parameter_id": "parameter://cal0/adaptation/harm-exponent@1",
      "reason": "The current summaries are invariant to the admissible perturbation."
    },
    {
      "classification": "PRACTICALLY_NON_IDENTIFIABLE",
      "confounding_family": null,
      "high_shifts": {
        "adult_capacity_p50": "0",
        "class_form_completion_rate": "0",
        "independent_mage_rate": "0",
        "injury_rate": "0",
        "skill_form_completion_rate": "0",
        "training_contribution_p50": "0"
      },
      "low_shifts": {
        "adult_capacity_p50": "0",
        "class_form_completion_rate": "0",
        "independent_mage_rate": "0",
        "injury_rate": "0",
        "skill_form_completion_rate": "0",
        "training_contribution_p50": "0"
      },
      "maximum_relative_effect": "0",
      "parameter_id": "parameter://cal0/adaptation/harm-scale@1",
      "reason": "The current summaries are invariant to the admissible perturbation."
    },
    {
      "classification": "INFLUENTIAL",
      "confounding_family": null,
      "high_shifts": {
        "adult_capacity_p50": "0.00355752",
        "class_form_completion_rate": "0",
        "independent_mage_rate": "0",
        "injury_rate": "0",
        "skill_form_completion_rate": "0",
        "training_contribution_p50": "0.05366122"
      },
      "low_shifts": {
        "adult_capacity_p50": "0.00365907",
        "class_form_completion_rate": "0",
        "independent_mage_rate": "0",
        "injury_rate": "0",
        "skill_form_completion_rate": "0",
        "training_contribution_p50": "0.05789707"
      },
      "maximum_relative_effect": "0.05789707",
      "parameter_id": "parameter://cal0/adaptation/headroom-beta@1",
      "reason": "One-at-a-time perturbation changes at least one protected I4 output."
    },
    {
      "classification": "MODERATE",
      "confounding_family": null,
      "high_shifts": {
        "adult_capacity_p50": "0.00269965",
        "class_form_completion_rate": "0",
        "independent_mage_rate": "0",
        "injury_rate": "0",
        "skill_form_completion_rate": "0",
        "training_contribution_p50": "0.01256295"
      },
      "low_shifts": {
        "adult_capacity_p50": "0.00216588",
        "class_form_completion_rate": "0",
        "independent_mage_rate": "0",
        "injury_rate": "0",
        "skill_form_completion_rate": "0",
        "training_contribution_p50": "0.01488298"
      },
      "maximum_relative_effect": "0.01488298",
      "parameter_id": "parameter://cal0/adaptation/maintenance@1",
      "reason": "One-at-a-time perturbation changes at least one protected I4 output."
    },
    {
      "classification": "INFLUENTIAL",
      "confounding_family": null,
      "high_shifts": {
        "adult_capacity_p50": "0.0051688",
        "class_form_completion_rate": "0",
        "independent_mage_rate": "0",
        "injury_rate": "0",
        "skill_form_completion_rate": "0",
        "training_contribution_p50": "0.05248203"
      },
      "low_shifts": {
        "adult_capacity_p50": "0.00193676",
        "class_form_completion_rate": "0",
        "independent_mage_rate": "0",
        "injury_rate": "0",